,Unnamed: 0,Text,Part,Document,Order,Sentence,Start,End,Annotator,Tag,Component,Speech,Speaker,SpeakerType,Set,Date,Year,Name,MainTag,NewBegin,NewEnd,idClip
680,13252,"We worked very closely with the foreign ministers of France, Germany and Great Britain, who have been the folks delivering the message to the mullahs that if you expect to be part of the world of nations, get rid of your nuclear programs.",89,29_2004,16,16,58156,58395,,"{""O"": 47}",O,"We worked very closely with the foreign ministers of France, Germany and Great Britain, who have been the folks delivering the message to the mullahs that if you expect to be part of the world of nations, get rid of your nuclear programs.",BUSH,Candidate,TRAIN,30 Sep 2004,2004,George W. Bush,O,3737.04,3751.48,clip_680
681,13253,The IAEA is involved.,89,29_2004,17,17,58396,58418,,"{""Premise"": 4, ""O"": 1}",Premise,The IAEA is involved.,BUSH,Candidate,TRAIN,30 Sep 2004,2004,George W. Bush,Premise,3751.48,3753.24,clip_681
682,13254,There's a special protocol recently been passed that allows for inspections.,89,29_2004,18,18,58418,58495,,"{""Premise"": 12, ""O"": 1}",Premise,There's a special protocol recently been passed that allows for inspections.,BUSH,Candidate,TRAIN,30 Sep 2004,2004,George W. Bush,Premise,3753.24,3758.08,clip_682
683,13255,I hope we can do it.,89,29_2004,19,19,58496,58517,,"{""O"": 7}",O,I hope we can do it.,BUSH,Candidate,TRAIN,30 Sep 2004,2004,George W. Bush,O,3758.08,3758.96,clip_683
684,13256,And we've got a good strategy.,89,29_2004,20,20,58517,58548,,"{""O"": 2, ""Claim"": 6}",Claim,And we've got a good strategy.,BUSH,Candidate,TRAIN,30 Sep 2004,2004,George W. Bush,Claim,3758.96,3761.92,clip_684
685,13257,"KERRY: With respect to Iran, the British, French, and Germans were the ones who initiated an effort without the United States, regrettably, to begin to try to move to curb the nuclear possibilities in Iran.",91,29_2004,0,0,58586,58793,,"{""O"": 42}",O," With respect to Iran, the British, French, and Germans were the ones who initiated an effort without the United States, regrettably, to begin to try to move to curb the nuclear possibilities in Iran.",KERRY,Candidate,TRAIN,30 Sep 2004,2004,John F. Kerry,O,3764.52,3778.28,clip_685
686,13258,I believe we could have done better.,91,29_2004,1,1,58793,58830,,"{""Claim"": 7, ""O"": 1}",Claim,I believe we could have done better.,KERRY,Candidate,TRAIN,30 Sep 2004,2004,John F. Kerry,Claim,3778.28,3779.96,clip_686
687,13259,"I think the United States should have offered the opportunity to provide the nuclear fuel, test them, see whether or not they were actually looking for it for peaceful purposes.",91,29_2004,2,2,58830,59008,,"{""Claim"": 32, ""O"": 1}",Claim,"I think the United States should have offered the opportunity to provide the nuclear fuel, test them, see whether or not they were actually looking for it for peaceful purposes.",KERRY,Candidate,TRAIN,30 Sep 2004,2004,John F. Kerry,Claim,3779.96,3789.48,clip_687
688,13260,"If they weren't willing to work a deal, then we could have put sanctions together.",91,29_2004,3,3,59008,59091,,"{""Claim"": 17, ""O"": 1}",Claim,"If they weren't willing to work a deal, then we could have put sanctions together.",KERRY,Candidate,TRAIN,30 Sep 2004,2004,John F. Kerry,Claim,3789.48,3792.56,clip_688
689,13261,The president did nothing.,91,29_2004,4,4,59091,59118,,"{""Claim"": 4, ""O"": 1}",Claim,The president did nothing.,KERRY,Candidate,TRAIN,30 Sep 2004,2004,John F. Kerry,Claim,3792.56,3794.44,clip_689
690,13262,"With respect to North Korea, the real story: We had inspectors and television cameras in the nuclear reactor in North Korea.",91,29_2004,5,5,59118,59243,,"{""Premise"": 23, ""O"": 1}",Premise,"With respect to North Korea, the real story: We had inspectors and television cameras in the nuclear reactor in North Korea.",KERRY,Candidate,TRAIN,30 Sep 2004,2004,John F. Kerry,Premise,3794.44,3803.16,clip_690
691,13263,Secretary Bill Perry negotiated that under President Clinton.,91,29_2004,6,6,59243,59305,,"{""Premise"": 8, ""O"": 1}",Premise,Secretary Bill Perry negotiated that under President Clinton.,KERRY,Candidate,TRAIN,30 Sep 2004,2004,John F. Kerry,Premise,3803.16,3807.24,clip_691
692,13264,And we knew where the fuel rods were.,91,29_2004,7,7,59305,59343,,"{""O"": 2, ""Premise"": 7}",Premise,And we knew where the fuel rods were.,KERRY,Candidate,TRAIN,30 Sep 2004,2004,John F. Kerry,Premise,3807.24,3809.4,clip_692
693,13265,And we knew the limits on their nuclear power.,91,29_2004,8,8,59343,59390,,"{""O"": 2, ""Premise"": 8}",Premise,And we knew the limits on their nuclear power.,KERRY,Candidate,TRAIN,30 Sep 2004,2004,John F. Kerry,Premise,3809.4,3811.6,clip_693
694,13266,"Colin Powell, our secretary of state, announced one day that we were going to continue the dialog of working with the North Koreans.",91,29_2004,9,9,59391,59524,,"{""O"": 26}",O,"Colin Powell, our secretary of state, announced one day that we were going to continue the dialog of working with the North Koreans.",KERRY,Candidate,TRAIN,30 Sep 2004,2004,John F. Kerry,O,3811.6,3817.48,clip_694
695,13267,The president reversed it publicly while the president of South Korea was here.,91,29_2004,10,10,59524,59604,,"{""Premise"": 13, ""O"": 1}",Premise,The president reversed it publicly while the president of South Korea was here.,KERRY,Candidate,TRAIN,30 Sep 2004,2004,John F. Kerry,Premise,3817.48,3822.68,clip_695
696,13268,And the president of South Korea went back to South Korea bewildered and embarrassed because it went against his policy.,91,29_2004,11,11,59605,59726,,"{""O"": 3, ""Claim"": 13, ""Premise"": 5}",Claim,And the president of South Korea went back to South Korea bewildered and embarrassed because it went against his policy.,KERRY,Candidate,TRAIN,30 Sep 2004,2004,John F. Kerry,Mixed,3822.68,3829.0,clip_696
697,13269,"And for two years, this administration didn't talk at all to North Korea.",91,29_2004,12,12,59726,59800,,"{""O"": 2, ""Premise"": 14}",Premise,"And for two years, this administration didn't talk at all to North Korea.",KERRY,Candidate,TRAIN,30 Sep 2004,2004,John F. Kerry,Premise,3829.0,3833.2,clip_697
698,13270,"While they didn't talk at all, the fuel rods came out, the inspectors were kicked out, the television cameras were kicked out.",91,29_2004,13,13,59801,59928,,"{""Premise"": 26, ""O"": 1}",Premise,"While they didn't talk at all, the fuel rods came out, the inspectors were kicked out, the television cameras were kicked out.",KERRY,Candidate,TRAIN,30 Sep 2004,2004,John F. Kerry,Premise,3833.2,3840.16,clip_698
699,13271,"And today, there are four to seven nuclear weapons in the hands of North Korea.",91,29_2004,14,14,59928,60008,,"{""O"": 2, ""Premise"": 15}",Premise,"And today, there are four to seven nuclear weapons in the hands of North Korea.",KERRY,Candidate,TRAIN,30 Sep 2004,2004,John F. Kerry,Premise,3840.16,3843.88,clip_699
700,13272,That happened on this president's watch.,91,29_2004,15,15,60009,60050,,"{""Premise"": 7, ""O"": 1}",Premise,That happened on this president's watch.,KERRY,Candidate,TRAIN,30 Sep 2004,2004,John F. Kerry,Premise,3843.88,3846.72,clip_700
701,13273,"Now, that, I think, is one of the most serious, sort of, reversals or mixed messages that you could possibly send.",91,29_2004,16,16,60051,60166,,"{""O"": 5, ""Claim"": 22}",Claim,"Now, that, I think, is one of the most serious, sort of, reversals or mixed messages that you could possibly send.",KERRY,Candidate,TRAIN,30 Sep 2004,2004,John F. Kerry,Claim,3846.72,3853.8,clip_701
702,13274,BUSH: Right.,93,29_2004,0,0,60413,60426,,"{""O"": 4}",O, Right.,BUSH,Candidate,TRAIN,30 Sep 2004,2004,George W. Bush,O,3866.24,3866.84,clip_702
703,13275,KERRY: Both.,95,29_2004,0,0,60467,60480,,"{""O"": 4}",O, Both.,KERRY,Candidate,TRAIN,30 Sep 2004,2004,John F. Kerry,O,3867.68,3868.08,clip_703
704,13276,"I want bilateral talks which put all of the issues, from the armistice of 1952, the economic issues, the human rights issues, the artillery disposal issues, the DMZ issues and the nuclear issues on the table.",95,29_2004,1,1,60480,60689,,"{""O"": 42}",O,"I want bilateral talks which put all of the issues, from the armistice of 1952, the economic issues, the human rights issues, the artillery disposal issues, the DMZ issues and the nuclear issues on the table.",KERRY,Candidate,TRAIN,30 Sep 2004,2004,John F. Kerry,O,3868.08,3882.16,clip_704
705,13277,"BUSH: The minute we have bilateral talks, the six-party talks will unwind.",97,29_2004,0,0,60734,60809,,"{""O"": 3, ""Claim"": 12}",Claim," The minute we have bilateral talks, the six-party talks will unwind.",BUSH,Candidate,TRAIN,30 Sep 2004,2004,George W. Bush,Claim,3884.4,3888.16,clip_705
706,13278,That's exactly what Kim Jong Il wants.,97,29_2004,1,1,60809,60848,,"{""Claim"": 8, ""O"": 1}",Claim,That's exactly what Kim Jong Il wants.,BUSH,Candidate,TRAIN,30 Sep 2004,2004,George W. Bush,Claim,3888.16,3891.32,clip_706
707,13279,"And by the way, the breach on the agreement was not through plutonium.",97,29_2004,2,2,60848,60919,,"{""O"": 6, ""Premise"": 9}",Premise,"And by the way, the breach on the agreement was not through plutonium.",BUSH,Candidate,TRAIN,30 Sep 2004,2004,George W. Bush,Premise,3891.32,3894.76,clip_707
708,13280,The breach on the agreement is highly enriched uranium.,97,29_2004,3,3,60919,60975,,"{""Premise"": 9, ""O"": 1}",Premise,The breach on the agreement is highly enriched uranium.,BUSH,Candidate,TRAIN,30 Sep 2004,2004,George W. Bush,Premise,3894.76,3897.36,clip_708
709,13281,That's what we caught him doing.,97,29_2004,4,4,60975,61008,,"{""Premise"": 7, ""O"": 1}",Premise,That's what we caught him doing.,BUSH,Candidate,TRAIN,30 Sep 2004,2004,George W. Bush,Premise,3897.36,3899.68,clip_709
710,13282,That's where he was breaking the agreement.,97,29_2004,5,5,61008,61052,,"{""Claim"": 8, ""O"": 1}",Claim,That's where he was breaking the agreement.,BUSH,Candidate,TRAIN,30 Sep 2004,2004,George W. Bush,Claim,3899.68,3901.48,clip_710
711,13283,"Secondly, he said -- my opponent said where he worked to put sanctions on Iran -- we've already sanctioned Iran.",97,29_2004,6,6,61052,61165,,"{""O"": 7, ""Claim"": 16}",Claim,"Secondly, he said -- my opponent said where he worked to put sanctions on Iran -- we've already sanctioned Iran.",BUSH,Candidate,TRAIN,30 Sep 2004,2004,George W. Bush,Claim,3901.48,3908.88,clip_711
712,13284,We can't sanction them any more.,97,29_2004,7,7,61165,61198,,"{""Claim"": 7, ""O"": 1}",Claim,We can't sanction them any more.,BUSH,Candidate,TRAIN,30 Sep 2004,2004,George W. Bush,Claim,3908.88,3910.88,clip_712
713,13285,There are sanctions in place on Iran.,97,29_2004,8,8,61198,61236,,"{""Claim"": 7, ""O"": 1}",Claim,There are sanctions in place on Iran.,BUSH,Candidate,TRAIN,30 Sep 2004,2004,George W. Bush,Claim,3910.88,3912.76,clip_713
714,13286,"And finally, we were a party to the convention -- to working with Germany, France and Great Britain to send their foreign ministers into Iran.",97,29_2004,9,9,61237,61380,,"{""O"": 4, ""Claim"": 24}",Claim,"And finally, we were a party to the convention -- to working with Germany, France and Great Britain to send their foreign ministers into Iran.",BUSH,Candidate,TRAIN,30 Sep 2004,2004,George W. Bush,Claim,3912.76,3920.56,clip_714
715,13287,"KERRY: Well, I'll tell you exactly why not, but I first want to say something about those sanctions on Iran.",99,29_2004,0,0,61791,61900,,"{""O"": 25}",O," Well, I'll tell you exactly why not, but I first want to say something about those sanctions on Iran.",KERRY,Candidate,TRAIN,30 Sep 2004,2004,John F. Kerry,O,3946.76,3952.48,clip_715
716,13288,"Only the United States put the sanctions on alone, and that's exactly what I'm talking about.",99,29_2004,1,1,61900,61994,,"{""Claim"": 9, ""O"": 11}",O,"Only the United States put the sanctions on alone, and that's exactly what I'm talking about.",KERRY,Candidate,TRAIN,30 Sep 2004,2004,John F. Kerry,Mixed,3952.48,3957.56,clip_716
717,13289,"In order for the sanctions to be effective, we should have been working with the British, French and Germans and other countries.",99,29_2004,2,2,61995,62125,,"{""Claim"": 24, ""O"": 1}",Claim,"In order for the sanctions to be effective, we should have been working with the British, French and Germans and other countries.",KERRY,Candidate,TRAIN,30 Sep 2004,2004,John F. Kerry,Claim,3957.56,3962.36,clip_717
718,13290,And that's the difference between the president and me.,99,29_2004,3,3,62125,62181,,"{""O"": 2, ""Claim"": 9}",Claim,And that's the difference between the president and me.,KERRY,Candidate,TRAIN,30 Sep 2004,2004,John F. Kerry,Claim,3962.36,3964.0,clip_718
719,13291,"And there, again, he sort of slid by the question.",99,29_2004,4,4,62182,62233,,"{""O"": 13}",O,"And there, again, he sort of slid by the question.",KERRY,Candidate,TRAIN,30 Sep 2004,2004,John F. Kerry,O,3964.0,3967.08,clip_719
720,13292,"Now, with respect to Darfur, yes, it is a genocide.",99,29_2004,5,5,62234,62286,,"{""O"": 3, ""Claim"": 11}",Claim,"Now, with respect to Darfur, yes, it is a genocide.",KERRY,Candidate,TRAIN,30 Sep 2004,2004,John F. Kerry,Claim,3967.08,3971.76,clip_720
721,13293,"And months ago, many of us were pressing for action.",99,29_2004,6,6,62286,62339,,"{""O"": 12}",O,"And months ago, many of us were pressing for action.",KERRY,Candidate,TRAIN,30 Sep 2004,2004,John F. Kerry,O,3971.76,3975.8,clip_721
722,13294,I think the reason that we're not saying send American troops in at this point is severalfold.,99,29_2004,7,7,62340,62435,,"{""Claim"": 18, ""O"": 1}",Claim,I think the reason that we're not saying send American troops in at this point is severalfold.,KERRY,Candidate,TRAIN,30 Sep 2004,2004,John F. Kerry,Claim,3975.8,3980.76,clip_722
723,13295,"Number one, we can do this through the African Union, providing we give them the logistical support.",99,29_2004,8,8,62436,62537,,"{""O"": 4, ""Claim"": 16}",Claim,"Number one, we can do this through the African Union, providing we give them the logistical support.",KERRY,Candidate,TRAIN,30 Sep 2004,2004,John F. Kerry,Claim,3980.76,3986.44,clip_723
724,13296,Right now all the president is providing is humanitarian support.,99,29_2004,9,9,62537,62603,,"{""Claim"": 10, ""O"": 1}",Claim,Right now all the president is providing is humanitarian support.,KERRY,Candidate,TRAIN,30 Sep 2004,2004,John F. Kerry,Claim,3986.44,3990.28,clip_724
725,13297,We need to do more than that.,99,29_2004,10,10,62603,62633,,"{""Claim"": 7, ""O"": 1}",Claim,We need to do more than that.,KERRY,Candidate,TRAIN,30 Sep 2004,2004,John F. Kerry,Claim,3990.28,3991.92,clip_725
726,13298,They've got to have the logistical capacity to go in and stop the killing.,99,29_2004,11,11,62633,62708,,"{""Claim"": 15, ""O"": 1}",Claim,They've got to have the logistical capacity to go in and stop the killing.,KERRY,Candidate,TRAIN,30 Sep 2004,2004,John F. Kerry,Claim,3991.92,3996.36,clip_726
727,13299,And that's going to require more than is on the table today.,99,29_2004,12,12,62708,62769,,"{""O"": 14}",O,And that's going to require more than is on the table today.,KERRY,Candidate,TRAIN,30 Sep 2004,2004,John F. Kerry,O,3996.36,3999.36,clip_727
728,13300,I also believe that it is -- one of the reasons we can't do it is we're overextended.,99,29_2004,13,13,62770,62856,,"{""Claim"": 20, ""O"": 1}",Claim,I also believe that it is -- one of the reasons we can't do it is we're overextended.,KERRY,Candidate,TRAIN,30 Sep 2004,2004,John F. Kerry,Claim,3999.36,4005.28,clip_728
729,13301,Ask the people in the armed forces today.,99,29_2004,14,14,62857,62899,,"{""O"": 9}",O,Ask the people in the armed forces today.,KERRY,Candidate,TRAIN,30 Sep 2004,2004,John F. Kerry,O,4005.28,4007.52,clip_729
730,13302,We've got Guards and Reserves who are doing double duties.,99,29_2004,15,15,62899,62958,,"{""Premise"": 11, ""O"": 1}",Premise,We've got Guards and Reserves who are doing double duties.,KERRY,Candidate,TRAIN,30 Sep 2004,2004,John F. Kerry,Premise,4007.52,4011.12,clip_730
731,13303,"We've got a backdoor draft taking place in America today: people with stop-loss programs where they're told you can't get out of the military; nine out of our 10 active duty divisions committed to Iraq one way or the other, either going, coming or preparing.",99,29_2004,16,16,62958,63217,,"{""Claim"": 11, ""O"": 3, ""Premise"": 39}",Premise,"We've got a backdoor draft taking place in America today: people with stop-loss programs where they're told you can't get out of the military; nine out of our 10 active duty divisions committed to Iraq one way or the other, either going, coming or preparing.",KERRY,Candidate,TRAIN,30 Sep 2004,2004,John F. Kerry,Mixed,4011.12,4026.28,clip_731
732,13304,So this is the way the president has overextended the United States.,99,29_2004,17,17,63218,63287,,"{""O"": 2, ""Claim"": 11}",Claim,So this is the way the president has overextended the United States.,KERRY,Candidate,TRAIN,30 Sep 2004,2004,John F. Kerry,Claim,4026.28,4029.28,clip_732
733,13305,"That's why, in my plan, I add two active duty divisions to the United States Army, not for Iraq, but for our general demands across the globe.",99,29_2004,18,18,63288,63431,,"{""O"": 5, ""Claim"": 28}",Claim,"That's why, in my plan, I add two active duty divisions to the United States Army, not for Iraq, but for our general demands across the globe.",KERRY,Candidate,TRAIN,30 Sep 2004,2004,John F. Kerry,Claim,4029.28,4038.92,clip_733
734,13306,I also intend to double the number of special forces so that we can do the job we need to do with respect fighting the terrorists around the world.,99,29_2004,19,19,63431,63579,,"{""Claim"": 27, ""O"": 3}",Claim,I also intend to double the number of special forces so that we can do the job we need to do with respect fighting the terrorists around the world.,KERRY,Candidate,TRAIN,30 Sep 2004,2004,John F. Kerry,Claim,4038.92,4046.84,clip_734
735,13307,"And if we do that, then we have the ability to be able to respond more rapidly.",99,29_2004,20,20,63579,63659,,"{""O"": 19}",O,"And if we do that, then we have the ability to be able to respond more rapidly.",KERRY,Candidate,TRAIN,30 Sep 2004,2004,John F. Kerry,O,4046.84,4050.88,clip_735
736,13308,"But I'll tell you this, as president, if it took American forces to some degree to coalesce the African Union, I'd be prepared to do it because we could never allow another Rwanda.",99,29_2004,21,21,63660,63841,,"{""O"": 9, ""Claim"": 24, ""Premise"": 6}",Claim,"But I'll tell you this, as president, if it took American forces to some degree to coalesce the African Union, I'd be prepared to do it because we could never allow another Rwanda.",KERRY,Candidate,TRAIN,30 Sep 2004,2004,John F. Kerry,Mixed,4050.88,4061.88,clip_736
737,13309,It's a moral responsibility for us and the world.,99,29_2004,22,22,63842,63892,,"{""Premise"": 10, ""O"": 1}",Premise,It's a moral responsibility for us and the world.,KERRY,Candidate,TRAIN,30 Sep 2004,2004,John F. Kerry,Premise,4061.88,4065.12,clip_737
738,13310,"BUSH: Back to Iran, just for a second.",101,29_2004,0,0,63919,63958,,"{""O"": 11}",O," Back to Iran, just for a second.",BUSH,Candidate,TRAIN,30 Sep 2004,2004,George W. Bush,O,4066.16,4068.28,clip_738
739,13311,It was not my administration that put the sanctions on Iran.,101,29_2004,1,1,63958,64019,,"{""Premise"": 11, ""O"": 1}",Premise,It was not my administration that put the sanctions on Iran.,BUSH,Candidate,TRAIN,30 Sep 2004,2004,George W. Bush,Premise,4068.28,4072.68,clip_739
740,13312,"That happened long before I arrived in Washington, D.C.",101,29_2004,2,2,64019,64075,,"{""Premise"": 11}",Premise,"That happened long before I arrived in Washington, D.C.",BUSH,Candidate,TRAIN,30 Sep 2004,2004,George W. Bush,Premise,4072.68,4078.28,clip_740
741,13313,"In terms of Darfur, I agree it's genocide.",101,29_2004,3,3,64076,64119,,"{""Claim"": 10, ""O"": 1}",Claim,"In terms of Darfur, I agree it's genocide.",BUSH,Candidate,TRAIN,30 Sep 2004,2004,George W. Bush,Claim,4078.28,4083.4,clip_741
742,13314,And Colin Powell so stated.,101,29_2004,4,4,64119,64147,,"{""O"": 2, ""Premise"": 4}",Premise,And Colin Powell so stated.,BUSH,Candidate,TRAIN,30 Sep 2004,2004,George W. Bush,Premise,4083.4,4087.28,clip_742
743,13315,We have committed $200 million worth of aid.,101,29_2004,5,5,64148,64193,,"{""O"": 10}",O,We have committed $200 million worth of aid.,BUSH,Candidate,TRAIN,30 Sep 2004,2004,George W. Bush,O,4087.28,4091.36,clip_743
744,13316,We're the leading donor in the world to help the suffering people there.,101,29_2004,6,6,64193,64266,,"{""O"": 15}",O,We're the leading donor in the world to help the suffering people there.,BUSH,Candidate,TRAIN,30 Sep 2004,2004,George W. Bush,O,4091.36,4094.52,clip_744
745,13317,We will commit more over time to help.,101,29_2004,7,7,64266,64305,,"{""O"": 9}",O,We will commit more over time to help.,BUSH,Candidate,TRAIN,30 Sep 2004,2004,George W. Bush,O,4094.52,4098.76,clip_745
746,13318,We were very much involved at the U.N. on the sanction policy of the Bashir government in the Sudan.,101,29_2004,8,8,64306,64407,,"{""O"": 20}",O,We were very much involved at the U.N. on the sanction policy of the Bashir government in the Sudan.,BUSH,Candidate,TRAIN,30 Sep 2004,2004,George W. Bush,O,4098.76,4106.72,clip_746
747,13319,"Prior to Darfur, Ambassador Jack Danforth had been negotiating a north-south agreement that we would have hoped would have brought peace to the Sudan.",101,29_2004,9,9,64407,64558,,"{""O"": 26}",O,"Prior to Darfur, Ambassador Jack Danforth had been negotiating a north-south agreement that we would have hoped would have brought peace to the Sudan.",BUSH,Candidate,TRAIN,30 Sep 2004,2004,George W. Bush,O,4106.72,4116.68,clip_747
748,13320,I agree with my opponent that we shouldn't be committing troops.,101,29_2004,10,10,64559,64624,,"{""Claim"": 12, ""O"": 1}",Claim,I agree with my opponent that we shouldn't be committing troops.,BUSH,Candidate,TRAIN,30 Sep 2004,2004,George W. Bush,Claim,4116.68,4120.8,clip_748
749,13321,We ought to be working with the African Union to do so -- precisely what we did in Liberia.,101,29_2004,11,11,64624,64716,,"{""Claim"": 18, ""O"": 2}",Claim,We ought to be working with the African Union to do so -- precisely what we did in Liberia.,BUSH,Candidate,TRAIN,30 Sep 2004,2004,George W. Bush,Claim,4120.8,4127.4,clip_749
750,13322,"We helped stabilize the situation with some troops, and when the African Union came, we moved them out.",101,29_2004,12,12,64716,64820,,"{""Premise"": 20, ""O"": 1}",Premise,"We helped stabilize the situation with some troops, and when the African Union came, we moved them out.",BUSH,Candidate,TRAIN,30 Sep 2004,2004,George W. Bush,Premise,4127.4,4132.76,clip_750
751,13323,My hope is that the African Union moves rapidly to help save lives.,101,29_2004,13,13,64821,64889,,"{""O"": 14}",O,My hope is that the African Union moves rapidly to help save lives.,BUSH,Candidate,TRAIN,30 Sep 2004,2004,George W. Bush,O,4132.76,4138.32,clip_751
752,13324,"And fortunately the rainy season will be ending shortly, which will make it easier to get aid there and help the long-suffering people there.",101,29_2004,14,14,64889,65031,,"{""O"": 26}",O,"And fortunately the rainy season will be ending shortly, which will make it easier to get aid there and help the long-suffering people there.",BUSH,Candidate,TRAIN,30 Sep 2004,2004,George W. Bush,O,4138.32,4147.72,clip_752
753,13325,BUSH: That's a loaded question.,103,29_2004,0,0,65319,65351,,"{""O"": 8}",O, That's a loaded question.,BUSH,Candidate,TRAIN,30 Sep 2004,2004,George W. Bush,O,4170.6,4174.12,clip_753
754,13326,"Well, first of all, I admire Senator Kerry's service to our country.",103,29_2004,1,1,65351,65420,,"{""O"": 16}",O,"Well, first of all, I admire Senator Kerry's service to our country.",BUSH,Candidate,TRAIN,30 Sep 2004,2004,George W. Bush,O,4174.12,4182.52,clip_754
755,13327,I admire the fact that he is a great dad.,103,29_2004,2,2,65420,65462,,"{""O"": 11}",O,I admire the fact that he is a great dad.,BUSH,Candidate,TRAIN,30 Sep 2004,2004,George W. Bush,O,4182.52,4186.6,clip_755
756,13328,"I appreciate the fact that his daughters have been so kind to my daughters in what has been a pretty hard experience for, I guess, young girls, seeing their dads out there campaigning.",103,29_2004,3,3,65462,65647,,"{""O"": 37}",O,"I appreciate the fact that his daughters have been so kind to my daughters in what has been a pretty hard experience for, I guess, young girls, seeing their dads out there campaigning.",BUSH,Candidate,TRAIN,30 Sep 2004,2004,George W. Bush,O,4186.6,4199.8,clip_756
757,13329,I admire the fact that he served for 20 years in the Senate.,103,29_2004,4,4,65647,65708,,"{""O"": 14}",O,I admire the fact that he served for 20 years in the Senate.,BUSH,Candidate,TRAIN,30 Sep 2004,2004,George W. Bush,O,4199.8,4207.8,clip_757
758,13330,Although I'm not so sure I admire the record.,103,29_2004,5,5,65708,65754,,"{""O"": 11}",O,Although I'm not so sure I admire the record.,BUSH,Candidate,TRAIN,30 Sep 2004,2004,George W. Bush,O,4207.8,4210.76,clip_758
759,13331,I won't hold it against him that he went to Yale.,103,29_2004,6,6,65755,65805,,"{""O"": 13}",O,I won't hold it against him that he went to Yale.,BUSH,Candidate,TRAIN,30 Sep 2004,2004,George W. Bush,O,4210.76,4215.68,clip_759
760,13332,There's nothing wrong with that.,103,29_2004,7,7,65805,65838,,"{""O"": 7}",O,There's nothing wrong with that.,BUSH,Candidate,TRAIN,30 Sep 2004,2004,George W. Bush,O,4215.68,4218.76,clip_760
