,Unnamed: 0,Unnamed: 0.1,Unnamed: 0.1.1,Text,Part,Document,Order,Sentence,Start,End,Annotator,Tag,Component,Speech,Speaker,SpeakerType,Set,Date,Year,Name,MainTag,NewBegin,NewEnd,idClip
266,268,268,15286,"All of these things are presently being rectified, and I think that we are going to salvage the farmers.",59,10_1984,9,9,40947,41052,,"{""Claim"": 21}",Claim,"All of these things are presently being rectified, and I think that we are going to salvage the farmers.",REAGAN,Candidate,TRAIN,07 Oct 1984,1984,Ronald W. Reagan,Claim,2799.56,2806.2,clip_268
267,269,269,15287,"As a matter of fact, there has been less than one-quarter of 1 percent of foreclosures of the 270,000 loans from government that the farmers have.",59,10_1984,10,10,41052,41199,,"{""Premise"": 28}",Premise,"As a matter of fact, there has been less than one-quarter of 1 percent of foreclosures of the 270,000 loans from government that the farmers have.",REAGAN,Candidate,TRAIN,07 Oct 1984,1984,Ronald W. Reagan,Premise,2806.2,2817.64,clip_269
268,270,270,15288,REAGAN: I have believed that in the appointment of judges that all that was specified in the party platform was that they respect the sanctity of human life.,62,10_1984,0,0,42028,42186,,"{""O"": 2, ""Claim"": 28}",Claim, I have believed that in the appointment of judges that all that was specified in the party platform was that they respect the sanctity of human life.,REAGAN,Candidate,TRAIN,07 Oct 1984,1984,Ronald W. Reagan,Claim,2874.32,2884.72,clip_270
269,271,271,15289,"Now, that I would want to see in any judge and with regard to any issue having to do with human life.",62,10_1984,1,1,42186,42288,,"{""O"": 3, ""Claim"": 21}",Claim,"Now, that I would want to see in any judge and with regard to any issue having to do with human life.",REAGAN,Candidate,TRAIN,07 Oct 1984,1984,Ronald W. Reagan,Claim,2884.72,2890.52,clip_271
270,272,272,15290,"But with regard to abortion, and I have a feeling that this is -- there's been some reference without naming it here in the remarks of Mr. Mondale tied to injecting religion into government.",62,10_1984,2,2,42288,42479,,"{""O"": 16, ""Premise"": 21}",Premise,"But with regard to abortion, and I have a feeling that this is -- there's been some reference without naming it here in the remarks of Mr. Mondale tied to injecting religion into government.",REAGAN,Candidate,TRAIN,07 Oct 1984,1984,Ronald W. Reagan,Premise,2890.52,2904.56,clip_272
271,273,273,15291,"With me, abortion is not a problem of religion, it's a problem of the Constitution.",62,10_1984,3,3,42479,42563,,"{""Claim"": 17, ""O"": 2}",Claim,"With me, abortion is not a problem of religion, it's a problem of the Constitution.",REAGAN,Candidate,TRAIN,07 Oct 1984,1984,Ronald W. Reagan,Claim,2904.56,2910.68,clip_273
272,274,274,15292,"I believe that until and unless someone can establish that the unborn child is not a living human being, then that child is already protected by the Constitution, which guarantees life, liberty, and the pursuit of happiness to all of us.",62,10_1984,4,4,42563,42801,,"{""Claim"": 44, ""O"": 2}",Claim,"I believe that until and unless someone can establish that the unborn child is not a living human being, then that child is already protected by the Constitution, which guarantees life, liberty, and the pursuit of happiness to all of us.",REAGAN,Candidate,TRAIN,07 Oct 1984,1984,Ronald W. Reagan,Claim,2910.68,2927.16,clip_274
273,275,275,15293,"And I think that this is what we should concentrate on, is trying -- I know there were weeks and weeks of testimony before a Senate committee, there were medical authorities, there were religious -- there were clerics there -- everyone talking about this matter of prolife.",62,10_1984,5,5,42801,43075,,"{""O"": 10, ""Claim"": 10, ""Premise"": 31}",Premise,"And I think that this is what we should concentrate on, is trying -- I know there were weeks and weeks of testimony before a Senate committee, there were medical authorities, there were religious -- there were clerics there -- everyone talking about this matter of prolife.",REAGAN,Candidate,TRAIN,07 Oct 1984,1984,Ronald W. Reagan,Mixed,2927.16,2944.6,clip_275
274,276,276,15294,"And at the end of all of that, not one shred of evidence was introduced that the unborn child was not alive.",62,10_1984,6,6,43075,43184,,"{""O"": 1, ""Claim"": 23}",Claim,"And at the end of all of that, not one shred of evidence was introduced that the unborn child was not alive.",REAGAN,Candidate,TRAIN,07 Oct 1984,1984,Ronald W. Reagan,Claim,2944.6,2953.0,clip_276
275,277,277,15295,"We have seen premature births that are now grown-up, happy people going around.",62,10_1984,7,7,43184,43264,,"{""Claim"": 14, ""O"": 1}",Claim,"We have seen premature births that are now grown-up, happy people going around.",REAGAN,Candidate,TRAIN,07 Oct 1984,1984,Ronald W. Reagan,Claim,2953.0,2957.36,clip_277
276,278,278,15296,"Also, there is a strange dichotomy in this whole position about our courts ruling that abortion is not the taking of a human life.",62,10_1984,8,8,43265,43396,,"{""O"": 26}",O,"Also, there is a strange dichotomy in this whole position about our courts ruling that abortion is not the taking of a human life.",REAGAN,Candidate,TRAIN,07 Oct 1984,1984,Ronald W. Reagan,O,2957.36,2964.92,clip_278
277,279,279,15297,"In California, sometime ago, a man beat a woman so savagely that her unborn child was born dead with a fractured skull, and the California State Legislature unanimously passed a law that was signed by the then-Democratic Governor -- signed a law that said that any man who so abuses a pregnant woman that he causes the death of her unborn child shall be charged with murder.",62,10_1984,9,9,43396,43771,,"{""Premise"": 68, ""O"": 3}",Premise,"In California, sometime ago, a man beat a woman so savagely that her unborn child was born dead with a fractured skull, and the California State Legislature unanimously passed a law that was signed by the then-Democratic Governor -- signed a law that said that any man who so abuses a pregnant woman that he causes the death of her unborn child shall be charged with murder.",REAGAN,Candidate,TRAIN,07 Oct 1984,1984,Ronald W. Reagan,Premise,2964.92,2996.96,clip_279
278,280,280,15298,"Now, isn't it strange that that same woman could have taken the life of her unborn child, and it was abortion and not murder, but if somebody else does it, that's murder?",62,10_1984,10,10,43771,43942,,"{""O"": 7, ""Claim"": 32}",Claim,"Now, isn't it strange that that same woman could have taken the life of her unborn child, and it was abortion and not murder, but if somebody else does it, that's murder?",REAGAN,Candidate,TRAIN,07 Oct 1984,1984,Ronald W. Reagan,Claim,2996.96,3008.6,clip_280
279,281,281,15299,"And it used the term ""death of the unborn child.''",62,10_1984,11,11,43942,43993,,"{""O"": 1, ""Premise"": 12}",Premise,"And it used the term ""death of the unborn child.''",REAGAN,Candidate,TRAIN,07 Oct 1984,1984,Ronald W. Reagan,Premise,3008.6,3012.16,clip_281
280,282,282,15300,"So, this has been my feeling about abortion, that we have a problem now to determine -- and all the evidence so far comes down on the side of the unborn child being a living human being.",62,10_1984,12,12,43994,44181,,"{""O"": 5, ""Claim"": 35}",Claim,"So, this has been my feeling about abortion, that we have a problem now to determine -- and all the evidence so far comes down on the side of the unborn child being a living human being.",REAGAN,Candidate,TRAIN,07 Oct 1984,1984,Ronald W. Reagan,Claim,3012.16,3027.52,clip_282
281,283,283,15301,REAGAN: The laws regarding that always were State laws.,64,10_1984,0,0,44617,44673,,"{""O"": 11}",O, The laws regarding that always were State laws.,REAGAN,Candidate,TRAIN,07 Oct 1984,1984,Ronald W. Reagan,O,3054.92,3058.76,clip_283
282,284,284,15302,It was only when the Supreme Court handed down a decision that the Federal Government intervened in what had always been a State policy.,64,10_1984,1,1,44673,44810,,"{""O"": 25}",O,It was only when the Supreme Court handed down a decision that the Federal Government intervened in what had always been a State policy.,REAGAN,Candidate,TRAIN,07 Oct 1984,1984,Ronald W. Reagan,O,3058.76,3064.92,clip_284
283,285,285,15303,Our laws against murder are State laws.,64,10_1984,2,2,44810,44850,,"{""Claim"": 7, ""O"": 1}",Claim,Our laws against murder are State laws.,REAGAN,Candidate,TRAIN,07 Oct 1984,1984,Ronald W. Reagan,Claim,3064.92,3067.92,clip_285
284,286,286,15304,"So, I would think that this would be the point of enforcement on this.",64,10_1984,3,3,44850,44921,,"{""O"": 2, ""Claim"": 14}",Claim,"So, I would think that this would be the point of enforcement on this.",REAGAN,Candidate,TRAIN,07 Oct 1984,1984,Ronald W. Reagan,Claim,3067.92,3076.28,clip_286
285,287,287,15305,"As I say, I feel that we have a problem here to resolve.",64,10_1984,4,4,44921,44978,,"{""O"": 4, ""Claim"": 11}",Claim,"As I say, I feel that we have a problem here to resolve.",REAGAN,Candidate,TRAIN,07 Oct 1984,1984,Ronald W. Reagan,Claim,3076.28,3080.64,clip_287
286,288,288,15306,And no one has approached it from that matter.,64,10_1984,5,5,44978,45025,,"{""O"": 2, ""Claim"": 8}",Claim,And no one has approached it from that matter.,REAGAN,Candidate,TRAIN,07 Oct 1984,1984,Ronald W. Reagan,Claim,3080.64,3086.0,clip_288
287,289,289,15307,It does not happen that the church that I belong to had that as part of its dogma.,64,10_1984,6,6,45025,45108,,"{""Premise"": 18, ""O"": 1}",Premise,It does not happen that the church that I belong to had that as part of its dogma.,REAGAN,Candidate,TRAIN,07 Oct 1984,1984,Ronald W. Reagan,Premise,3086.0,3091.36,clip_289
288,290,290,15308,I know that some churches do.,64,10_1984,7,7,45108,45138,,"{""Claim"": 6, ""O"": 1}",Claim,I know that some churches do.,REAGAN,Candidate,TRAIN,07 Oct 1984,1984,Ronald W. Reagan,Claim,3091.36,3094.0,clip_290
289,291,291,15309,"Now, it is a sin if you're taking a human life.",64,10_1984,8,8,45139,45187,,"{""O"": 3, ""Claim"": 11}",Claim,"Now, it is a sin if you're taking a human life.",REAGAN,Candidate,TRAIN,07 Oct 1984,1984,Ronald W. Reagan,Claim,3094.0,3097.16,clip_291
290,292,292,15310,"At the same time, in our Judeo-Christian tradition, we recognize the right of taking a human life in self-defense.",64,10_1984,9,9,45187,45302,,"{""O"": 6, ""Premise"": 16}",Premise,"At the same time, in our Judeo-Christian tradition, we recognize the right of taking a human life in self-defense.",REAGAN,Candidate,TRAIN,07 Oct 1984,1984,Ronald W. Reagan,Premise,3097.16,3106.36,clip_292
291,293,293,15311,"And therefore, I've always believed that a mother, if medically it is determined that her life is at risk if she goes through with the pregnancy, she has a right then to take the life of even her own unborn child in defense of her own.",64,10_1984,10,10,45302,45538,,"{""O"": 3, ""Claim"": 48}",Claim,"And therefore, I've always believed that a mother, if medically it is determined that her life is at risk if she goes through with the pregnancy, she has a right then to take the life of even her own unborn child in defense of her own.",REAGAN,Candidate,TRAIN,07 Oct 1984,1984,Ronald W. Reagan,Claim,3106.36,3121.4,clip_293
292,294,294,15312,MONDALE: This is one of the most emotional and difficult issues that could possibly be debated.,66,10_1984,0,0,45940,46036,,"{""O"": 18}",O, This is one of the most emotional and difficult issues that could possibly be debated.,MONDALE,Candidate,TRAIN,07 Oct 1984,1984,Walter F. Mondale,O,3148.4,3155.36,clip_294
293,295,295,15313,"I think your questions, however, underscore the fact there is probably no way that government should or could answer this question in every individual case and in the private lives of the American people.",66,10_1984,1,1,46036,46241,,"{""O"": 37}",O,"I think your questions, however, underscore the fact there is probably no way that government should or could answer this question in every individual case and in the private lives of the American people.",MONDALE,Candidate,TRAIN,07 Oct 1984,1984,Walter F. Mondale,O,3155.36,3171.36,clip_295
294,296,296,15314,The constitutional amendment proposed by President Reagan would make it a crime for a woman to have an abortion if she had been raped or suffered from incest.,66,10_1984,2,2,46241,46400,,"{""Claim"": 29}",Claim,The constitutional amendment proposed by President Reagan would make it a crime for a woman to have an abortion if she had been raped or suffered from incest.,MONDALE,Candidate,TRAIN,07 Oct 1984,1984,Walter F. Mondale,Claim,3171.36,3186.6,clip_296
295,297,297,15315,"Is it really the view of the American people, however you feel on the question of abortion, that government ought to be reaching into your livingrooms and making choices like this?",66,10_1984,3,3,46400,46581,,"{""Claim"": 9, ""O"": 25}",O,"Is it really the view of the American people, however you feel on the question of abortion, that government ought to be reaching into your livingrooms and making choices like this?",MONDALE,Candidate,TRAIN,07 Oct 1984,1984,Walter F. Mondale,Mixed,3186.6,3199.52,clip_297
296,298,298,15316,"I think it cannot work, won't work, and will lead to all kinds of cynical evasions of the law.",66,10_1984,4,4,46581,46676,,"{""Claim"": 20, ""O"": 4}",Claim,"I think it cannot work, won't work, and will lead to all kinds of cynical evasions of the law.",MONDALE,Candidate,TRAIN,07 Oct 1984,1984,Walter F. Mondale,Claim,3199.52,3208.36,clip_298
297,299,299,15317,Those who can afford to have them will continue to have them.,66,10_1984,5,5,46676,46738,,"{""Claim"": 13}",Claim,Those who can afford to have them will continue to have them.,MONDALE,Candidate,TRAIN,07 Oct 1984,1984,Walter F. Mondale,Claim,3208.36,3211.56,clip_299
298,300,300,15318,The disadvantaged will go out in the back alley as they used to do.,66,10_1984,6,6,46738,46806,,"{""Claim"": 15}",Claim,The disadvantaged will go out in the back alley as they used to do.,MONDALE,Candidate,TRAIN,07 Oct 1984,1984,Walter F. Mondale,Claim,3211.56,3217.36,clip_300
299,301,301,15319,"I think these questions are inherently personal and moral, and every individual instance is different.",66,10_1984,7,7,46807,46910,,"{""Claim"": 14, ""O"": 3}",Claim,"I think these questions are inherently personal and moral, and every individual instance is different.",MONDALE,Candidate,TRAIN,07 Oct 1984,1984,Walter F. Mondale,Claim,3217.36,3226.84,clip_301
300,302,302,15320,Every American should be aware of the seriousness of the step.,66,10_1984,8,8,46910,46973,,"{""Claim"": 12}",Claim,Every American should be aware of the seriousness of the step.,MONDALE,Candidate,TRAIN,07 Oct 1984,1984,Walter F. Mondale,Claim,3226.84,3232.36,clip_302
301,303,303,15321,But there are some things that government can do and some things they cannot do.,66,10_1984,9,9,46973,47054,,"{""O"": 2, ""Claim"": 15}",Claim,But there are some things that government can do and some things they cannot do.,MONDALE,Candidate,TRAIN,07 Oct 1984,1984,Walter F. Mondale,Claim,3232.36,3239.08,clip_303
302,304,304,15322,"Now, the example that the President cites has nothing to do with abortion.",66,10_1984,10,10,47055,47130,,"{""O"": 2, ""Premise"": 13}",Premise,"Now, the example that the President cites has nothing to do with abortion.",MONDALE,Candidate,TRAIN,07 Oct 1984,1984,Walter F. Mondale,Premise,3239.08,3242.76,clip_304
303,305,305,15323,Somebody went to a woman and nearly killed her.,66,10_1984,11,11,47130,47178,,"{""Premise"": 9, ""O"": 1}",Premise,Somebody went to a woman and nearly killed her.,MONDALE,Candidate,TRAIN,07 Oct 1984,1984,Walter F. Mondale,Premise,3242.76,3245.68,clip_305
304,306,306,15324,That's always been a serious crime and always should be a serious crime.,66,10_1984,12,12,47178,47251,,"{""Claim"": 15}",Claim,That's always been a serious crime and always should be a serious crime.,MONDALE,Candidate,TRAIN,07 Oct 1984,1984,Walter F. Mondale,Claim,3245.68,3251.88,clip_306
305,307,307,15325,But how does that compare with the problem of a woman who is raped?,66,10_1984,13,13,47251,47319,,"{""O"": 15}",O,But how does that compare with the problem of a woman who is raped?,MONDALE,Candidate,TRAIN,07 Oct 1984,1984,Walter F. Mondale,O,3251.88,3256.72,clip_307
306,308,308,15326,Do we really want those decisions made by judges who've been picked because they will agree to find the person guilty?,66,10_1984,14,14,47319,47438,,"{""Claim"": 23}",Claim,Do we really want those decisions made by judges who've been picked because they will agree to find the person guilty?,MONDALE,Candidate,TRAIN,07 Oct 1984,1984,Walter F. Mondale,Claim,3256.72,3268.04,clip_308
307,309,309,15327,"I don't think so, and I think it's going in exactly the wrong direction.",66,10_1984,15,15,47438,47511,,"{""Claim"": 15, ""O"": 3}",Claim,"I don't think so, and I think it's going in exactly the wrong direction.",MONDALE,Candidate,TRAIN,07 Oct 1984,1984,Walter F. Mondale,Claim,3268.04,3272.88,clip_309
308,310,310,15328,"In America, on basic moral questions we have always let the people decide in their own personal lives.",66,10_1984,16,16,47512,47615,,"{""Premise"": 7, ""Claim"": 12, ""O"": 1}",Claim,"In America, on basic moral questions we have always let the people decide in their own personal lives.",MONDALE,Candidate,TRAIN,07 Oct 1984,1984,Walter F. Mondale,Mixed,3272.88,3282.64,clip_310
309,311,311,15329,We haven't felt so insecure that we've reached for the club of state to have our point of view.,66,10_1984,17,17,47615,47711,,"{""Claim"": 22}",Claim,We haven't felt so insecure that we've reached for the club of state to have our point of view.,MONDALE,Candidate,TRAIN,07 Oct 1984,1984,Walter F. Mondale,Claim,3282.64,3289.32,clip_311
310,312,312,15330,It's been a good instinct.,66,10_1984,18,18,47711,47738,,"{""Claim"": 7}",Claim,It's been a good instinct.,MONDALE,Candidate,TRAIN,07 Oct 1984,1984,Walter F. Mondale,Claim,3289.32,3291.16,clip_312
311,313,313,15331,And we're the most religious people on Earth.,66,10_1984,19,19,47738,47784,,"{""O"": 2, ""Claim"": 8}",Claim,And we're the most religious people on Earth.,MONDALE,Candidate,TRAIN,07 Oct 1984,1984,Walter F. Mondale,Claim,3291.16,3293.24,clip_313
313,315,315,15333,"MONDALE: The basic decision of the Supreme Court is that each person has to make this judgment in her own life, and that's the way it's been done.",68,10_1984,0,0,48420,48567,,"{""O"": 33}",O," The basic decision of the Supreme Court is that each person has to make this judgment in her own life, and that's the way it's been done.",MONDALE,Candidate,TRAIN,07 Oct 1984,1984,Walter F. Mondale,O,3335.48,3346.64,clip_315
314,316,316,15334,"And it's a personal and private, moral judgment.",68,10_1984,1,1,48567,48616,,"{""O"": 2, ""Claim"": 9}",Claim,"And it's a personal and private, moral judgment.",MONDALE,Candidate,TRAIN,07 Oct 1984,1984,Walter F. Mondale,Claim,3346.64,3350.92,clip_316
315,317,317,15335,I don't know the answer to when life begins.,68,10_1984,2,2,48616,48661,,"{""Claim"": 10, ""O"": 1}",Claim,I don't know the answer to when life begins.,MONDALE,Candidate,TRAIN,07 Oct 1984,1984,Walter F. Mondale,Claim,3350.92,3354.0,clip_317
316,318,318,15336,"And it's not that simple, either.",68,10_1984,3,3,48661,48695,,"{""O"": 2, ""Claim"": 7}",Claim,"And it's not that simple, either.",MONDALE,Candidate,TRAIN,07 Oct 1984,1984,Walter F. Mondale,Claim,3354.0,3356.08,clip_318
317,319,319,15337,You've got another life involved.,68,10_1984,4,4,48695,48729,,"{""Premise"": 6, ""O"": 1}",Premise,You've got another life involved.,MONDALE,Candidate,TRAIN,07 Oct 1984,1984,Walter F. Mondale,Premise,3356.08,3358.32,clip_319
318,320,320,15338,"And if it's rape, how do you draw moral judgments on that?",68,10_1984,5,5,48729,48788,,"{""O"": 1, ""Claim"": 14}",Claim,"And if it's rape, how do you draw moral judgments on that?",MONDALE,Candidate,TRAIN,07 Oct 1984,1984,Walter F. Mondale,Claim,3358.32,3362.92,clip_320
319,321,321,15339,"If it's incest, how do you draw moral judgments on that?",68,10_1984,6,6,48788,48845,,"{""Claim"": 14}",Claim,"If it's incest, how do you draw moral judgments on that?",MONDALE,Candidate,TRAIN,07 Oct 1984,1984,Walter F. Mondale,Claim,3362.92,3367.04,clip_321
320,322,322,15340,Does every woman in America have to present herself before some judge picked by Jerry Falwell to clear her personal judgment?,68,10_1984,7,7,48845,48971,,"{""Claim"": 22}",Claim,Does every woman in America have to present herself before some judge picked by Jerry Falwell to clear her personal judgment?,MONDALE,Candidate,TRAIN,07 Oct 1984,1984,Walter F. Mondale,Claim,3367.04,3371.4,clip_322
321,323,323,15341,It won't work.,68,10_1984,8,8,48971,48986,,"{""Claim"": 5}",Claim,It won't work.,MONDALE,Candidate,TRAIN,07 Oct 1984,1984,Walter F. Mondale,Claim,3371.4,3371.84,clip_323
322,326,326,15344,"Well, with regard to this being a personal choice, isn't that what a murderer is insisting on, his or her right to kill someone because of whatever fault they think justifies that?",70,10_1984,1,1,49365,49546,,"{""O"": 37}",O,"Well, with regard to this being a personal choice, isn't that what a murderer is insisting on, his or her right to kill someone because of whatever fault they think justifies that?",REAGAN,Candidate,TRAIN,07 Oct 1984,1984,Ronald W. Reagan,O,3401.72,3415.04,clip_326
323,327,327,15345,"Now, I'm not capable, and I don't think you are, any of us, to make this determination that must be made with regard to human life.",70,10_1984,2,2,49546,49678,,"{""O"": 5, ""Claim"": 28}",Claim,"Now, I'm not capable, and I don't think you are, any of us, to make this determination that must be made with regard to human life.",REAGAN,Candidate,TRAIN,07 Oct 1984,1984,Ronald W. Reagan,Claim,3415.04,3422.36,clip_327
324,328,328,15346,I am simply saying that I believe that that's where the effort should be directed -- to make that determination.,70,10_1984,3,3,49678,49791,,"{""O"": 6, ""Claim"": 16}",Claim,I am simply saying that I believe that that's where the effort should be directed -- to make that determination.,REAGAN,Candidate,TRAIN,07 Oct 1984,1984,Ronald W. Reagan,Claim,3422.36,3429.2,clip_328
325,329,329,15347,I don't think that any of us should be called upon here to stand and make a decision as to what other things might come under the self-defense tradition.,70,10_1984,4,4,49792,49946,,"{""Claim"": 30, ""O"": 1}",Claim,I don't think that any of us should be called upon here to stand and make a decision as to what other things might come under the self-defense tradition.,REAGAN,Candidate,TRAIN,07 Oct 1984,1984,Ronald W. Reagan,Claim,3429.2,3438.6,clip_329
326,330,330,15348,"That, too, would have to be worked out then, when you once recognize that we're talking about a life.",70,10_1984,5,5,49946,50048,,"{""Claim"": 11, ""O"": 2, ""Premise"": 11}",Claim,"That, too, would have to be worked out then, when you once recognize that we're talking about a life.",REAGAN,Candidate,TRAIN,07 Oct 1984,1984,Ronald W. Reagan,Mixed,3438.6,3444.32,clip_330
327,331,331,15349,"But in this great society of ours, wouldn't it make a lot more sense, in this gentle and kind society, if we had a program that made it possible for when incidents come along in which someone feels they must do away with that unborn child, that instead we make it available for the adoption?",70,10_1984,6,6,50048,50340,,"{""O"": 61}",O,"But in this great society of ours, wouldn't it make a lot more sense, in this gentle and kind society, if we had a program that made it possible for when incidents come along in which someone feels they must do away with that unborn child, that instead we make it available for the adoption?",REAGAN,Candidate,TRAIN,07 Oct 1984,1984,Ronald W. Reagan,O,3444.32,3462.8,clip_331
328,332,332,15350,There are a million and a half people out there standing in line waiting to adopt children who can't have them any other way.,70,10_1984,7,7,50340,50466,,"{""Claim"": 26}",Claim,There are a million and a half people out there standing in line waiting to adopt children who can't have them any other way.,REAGAN,Candidate,TRAIN,07 Oct 1984,1984,Ronald W. Reagan,Claim,3462.8,3468.52,clip_332
329,333,333,15351,"MONDALE: I agree with that, and that's why I was a principal sponsor of a liberal adoption law, so that more of these children could come to term, so that the young mothers were educated, so we found an option, an alternative.",72,10_1984,0,0,50491,50718,,"{""O"": 8, ""Claim"": 34, ""Premise"": 8}",Claim," I agree with that, and that's why I was a principal sponsor of a liberal adoption law, so that more of these children could come to term, so that the young mothers were educated, so we found an option, an alternative.",MONDALE,Candidate,TRAIN,07 Oct 1984,1984,Walter F. Mondale,Mixed,3470.88,3484.6,clip_333
330,334,334,15352,I'm all for that.,72,10_1984,1,1,50718,50736,,"{""O"": 6}",O,I'm all for that.,MONDALE,Candidate,TRAIN,07 Oct 1984,1984,Walter F. Mondale,O,3484.6,3485.48,clip_334
331,335,335,15353,But the question is whether this other option proposed by the President should be pursued.,72,10_1984,2,2,50736,50827,,"{""O"": 2, ""Claim"": 14}",Claim,But the question is whether this other option proposed by the President should be pursued.,MONDALE,Candidate,TRAIN,07 Oct 1984,1984,Walter F. Mondale,Claim,3485.48,3490.64,clip_335
332,336,336,15354,And I don't agree with it.,72,10_1984,3,3,50827,50854,,"{""O"": 2, ""Claim"": 6}",Claim,And I don't agree with it.,MONDALE,Candidate,TRAIN,07 Oct 1984,1984,Walter F. Mondale,Claim,3490.64,3492.0,clip_336
333,337,337,15355,"Since I've got about 20 seconds, let me just say one thing.",72,10_1984,4,4,50854,50914,,"{""O"": 15}",O,"Since I've got about 20 seconds, let me just say one thing.",MONDALE,Candidate,TRAIN,07 Oct 1984,1984,Walter F. Mondale,O,3492.0,3496.68,clip_337
