,Text,Part,Document,Order,Sentence,Start,End,Annotator,Tag,Component,Speech,Speaker,SpeakerType,Set,Date,Year,Name,MainTag,NewBegin,NewEnd,idClip
440,"And the president, his first legislative priority was the No Child Left Behind Act.",80,30_2004,12,12,49205,49289,,"{""O"": 2, ""Premise"": 14}",Premise,"And the president, his first legislative priority was the No Child Left Behind Act.",CHENEY,Candidate,TRAIN,05 Oct 2004,2004,Richard(Dick) B. Cheney,Premise,2800.16,2805.08,NOT_FOUND
441,It was the first piece of legislation we introduced.,80,30_2004,13,13,49289,49342,,"{""O"": 10}",O,It was the first piece of legislation we introduced.,CHENEY,Candidate,TRAIN,05 Oct 2004,2004,Richard(Dick) B. Cheney,O,2805.08,2808.24,NOT_FOUND
442,We got it passed that first summer on a bipartisan basis.,80,30_2004,14,14,49343,49401,,"{""O"": 12}",O,We got it passed that first summer on a bipartisan basis.,CHENEY,Candidate,TRAIN,05 Oct 2004,2004,Richard(Dick) B. Cheney,O,2808.24,2811.12,NOT_FOUND
443,We even had Ted Kennedy on board for the effort.,80,30_2004,15,15,49401,49450,,"{""O"": 11}",O,We even had Ted Kennedy on board for the effort.,CHENEY,Candidate,TRAIN,05 Oct 2004,2004,Richard(Dick) B. Cheney,O,2811.12,2814.28,NOT_FOUND
444,And it does several things.,80,30_2004,16,16,49451,49479,,"{""O"": 6}",O,And it does several things.,CHENEY,Candidate,TRAIN,05 Oct 2004,2004,Richard(Dick) B. Cheney,O,2814.28,2816.04,NOT_FOUND
445,It establishes high standards.,80,30_2004,17,17,49479,49510,,"{""Claim"": 4, ""O"": 1}",Claim,It establishes high standards.,CHENEY,Candidate,TRAIN,05 Oct 2004,2004,Richard(Dick) B. Cheney,Claim,2816.04,2818.24,NOT_FOUND
446,"It, at the same time, sets up a system of testing with respect to our school system, so we can establish accountability to parents and make certain that they understand how well their students are doing.",80,30_2004,18,18,49510,49714,,"{""O"": 10, ""Premise"": 30}",Premise,"It, at the same time, sets up a system of testing with respect to our school system, so we can establish accountability to parents and make certain that they understand how well their students are doing.",CHENEY,Candidate,TRAIN,05 Oct 2004,2004,Richard(Dick) B. Cheney,Premise,2818.24,2830.24,NOT_FOUND
447,And they have the opportunity to move students out of poorly performing schools to good schools.,80,30_2004,19,19,49714,49811,,"{""O"": 2, ""Claim"": 15}",Claim,And they have the opportunity to move students out of poorly performing schools to good schools.,CHENEY,Candidate,TRAIN,05 Oct 2004,2004,Richard(Dick) B. Cheney,Claim,2830.24,2835.44,NOT_FOUND
448,It strikes me that that is absolutely the heart of what needs to be done from the standpoint of education.,80,30_2004,20,20,49812,49919,,"{""O"": 11, ""Premise"": 10}",O,It strikes me that that is absolutely the heart of what needs to be done from the standpoint of education.,CHENEY,Candidate,TRAIN,05 Oct 2004,2004,Richard(Dick) B. Cheney,Mixed,2835.44,2839.96,NOT_FOUND
449,"It's also important, as we go forward in the next term, we want to be able to take what we've done for elementary education and move it into the secondary education.",80,30_2004,21,21,49920,50086,,"{""Premise"": 13, ""O"": 2, ""Claim"": 21}",Claim,"It's also important, as we go forward in the next term, we want to be able to take what we've done for elementary education and move it into the secondary education.",CHENEY,Candidate,TRAIN,05 Oct 2004,2004,Richard(Dick) B. Cheney,Mixed,2839.96,2850.08,NOT_FOUND
450,It's working.,80,30_2004,22,22,50087,50101,,"{""Premise"": 3, ""O"": 1}",Premise,It's working.,CHENEY,Candidate,TRAIN,05 Oct 2004,2004,Richard(Dick) B. Cheney,Premise,2850.08,2850.68,NOT_FOUND
451,We've seen reports now of a reduction in the achievement gap between majority students and minority students.,80,30_2004,23,23,50101,50211,,"{""Premise"": 18, ""O"": 1}",Premise,We've seen reports now of a reduction in the achievement gap between majority students and minority students.,CHENEY,Candidate,TRAIN,05 Oct 2004,2004,Richard(Dick) B. Cheney,Premise,2850.68,2857.68,NOT_FOUND
452,We're making significant progress.,80,30_2004,24,24,50211,50246,,"{""Claim"": 5, ""O"": 1}",Claim,We're making significant progress.,CHENEY,Candidate,TRAIN,05 Oct 2004,2004,Richard(Dick) B. Cheney,Claim,2857.68,2858.92,NOT_FOUND
453,"EDWARDS: Gwen, your question was about jobs?",82,30_2004,0,0,50294,50339,,"{""O"": 10}",O," Gwen, your question was about jobs?",EDWARDS,Candidate,TRAIN,05 Oct 2004,2004,Johnny(John) R. Edwards,O,2860.72,2862.48,NOT_FOUND
454,EDWARDS: I thought it was about jobs and poverty.,84,30_2004,0,0,50393,50443,,"{""O"": 11}",O, I thought it was about jobs and poverty.,EDWARDS,Candidate,TRAIN,05 Oct 2004,2004,Johnny(John) R. Edwards,O,2864.68,2867.0,NOT_FOUND
455,"I hope we get a chance to talk about education, but that's what the vice president talked about.",84,30_2004,1,1,50443,50540,,"{""O"": 21}",O,"I hope we get a chance to talk about education, but that's what the vice president talked about.",EDWARDS,Candidate,TRAIN,05 Oct 2004,2004,Johnny(John) R. Edwards,O,2867.0,2871.36,NOT_FOUND
456,"Here's what's happened: In the time that they have been in office, in the last four years, 1.6 million private sector jobs have been lost, 2.7 million manufacturing jobs have been lost.",84,30_2004,2,2,50540,50726,,"{""O"": 17, ""Claim"": 22}",Claim,"Here's what's happened: In the time that they have been in office, in the last four years, 1.6 million private sector jobs have been lost, 2.7 million manufacturing jobs have been lost.",EDWARDS,Candidate,TRAIN,05 Oct 2004,2004,Johnny(John) R. Edwards,Claim,2871.36,2885.16,NOT_FOUND
457,And it's had real consequences in places like Cleveland.,84,30_2004,3,3,50726,50783,,"{""O"": 2, ""Premise"": 9}",Premise,And it's had real consequences in places like Cleveland.,EDWARDS,Candidate,TRAIN,05 Oct 2004,2004,Johnny(John) R. Edwards,Premise,2885.16,2887.52,NOT_FOUND
458,"Cleveland is a wonderful, distinguished city that's done a lot of great things, but it has the highest poverty rate in the country.",84,30_2004,4,4,50784,50916,,"{""O"": 18, ""Premise"": 9}",O,"Cleveland is a wonderful, distinguished city that's done a lot of great things, but it has the highest poverty rate in the country.",EDWARDS,Candidate,TRAIN,05 Oct 2004,2004,Johnny(John) R. Edwards,Mixed,2887.52,2893.44,NOT_FOUND
459,One out of almost two children in Cleveland are now living in poverty.,84,30_2004,5,5,50916,50987,,"{""Claim"": 13, ""O"": 1}",Claim,One out of almost two children in Cleveland are now living in poverty.,EDWARDS,Candidate,TRAIN,05 Oct 2004,2004,Johnny(John) R. Edwards,Claim,2893.44,2895.84,NOT_FOUND
460,"During the time that the vice president and the president have been in office, 4 million more Americans have fallen into poverty.",84,30_2004,6,6,50988,51118,,"{""O"": 24}",O,"During the time that the vice president and the president have been in office, 4 million more Americans have fallen into poverty.",EDWARDS,Candidate,TRAIN,05 Oct 2004,2004,Johnny(John) R. Edwards,O,2899.96,2904.88,NOT_FOUND
461,"During the time that the vice president and the president have been in office, 4 million more Americans have fallen into poverty.",84,30_2004,7,7,50988,51118,,{},,"During the time that the vice president and the president have been in office, 4 million more Americans have fallen into poverty.",EDWARDS,Candidate,TRAIN,05 Oct 2004,2004,Johnny(John) R. Edwards,Mixed,2899.96,2904.88,NOT_FOUND
462,"And what the most striking and startling thing is, they are the first presidency in 70 years -- and I'm talking Democrats, Republican, presidents who led us through World War, through the Korean War, the Vietnam War, Cold War -- every one of them created jobs until this president.",84,30_2004,8,8,51250,51532,,"{""O"": 57}",O,"And what the most striking and startling thing is, they are the first presidency in 70 years -- and I'm talking Democrats, Republican, presidents who led us through World War, through the Korean War, the Vietnam War, Cold War -- every one of them created jobs until this president.",EDWARDS,Candidate,TRAIN,05 Oct 2004,2004,Johnny(John) R. Edwards,O,2904.88,2923.0,NOT_FOUND
463,We have to do better.,84,30_2004,9,9,51533,51555,,"{""Claim"": 5, ""O"": 1}",Claim,We have to do better.,EDWARDS,Candidate,TRAIN,05 Oct 2004,2004,Johnny(John) R. Edwards,Claim,2923.0,2924.52,NOT_FOUND
464,We have a plan.,84,30_2004,10,10,51555,51571,,"{""Claim"": 4, ""O"": 1}",Claim,We have a plan.,EDWARDS,Candidate,TRAIN,05 Oct 2004,2004,Johnny(John) R. Edwards,Claim,2924.52,2925.88,NOT_FOUND
465,"We're going to get rid of -- by the way, they're for outsourcing jobs.",84,30_2004,11,11,51571,51642,,"{""Premise"": 17, ""O"": 1}",Premise,"We're going to get rid of -- by the way, they're for outsourcing jobs.",EDWARDS,Candidate,TRAIN,05 Oct 2004,2004,Johnny(John) R. Edwards,Premise,2925.88,2930.08,NOT_FOUND
466,"I want to make sure people hear that, the fundamental difference with us.",84,30_2004,12,12,51642,51716,,"{""Claim"": 14, ""O"": 1}",Claim,"I want to make sure people hear that, the fundamental difference with us.",EDWARDS,Candidate,TRAIN,05 Oct 2004,2004,Johnny(John) R. Edwards,Claim,2930.08,2933.56,NOT_FOUND
467,The administration says over and over that the outsourcing of millions of American jobs is good.,84,30_2004,13,13,51716,51813,,"{""Premise"": 16, ""O"": 1}",Premise,The administration says over and over that the outsourcing of millions of American jobs is good.,EDWARDS,Candidate,TRAIN,05 Oct 2004,2004,Johnny(John) R. Edwards,Premise,2933.56,2937.8,NOT_FOUND
468,We're against it.,84,30_2004,14,14,51813,51831,,"{""Claim"": 4, ""O"": 1}",Claim,We're against it.,EDWARDS,Candidate,TRAIN,05 Oct 2004,2004,Johnny(John) R. Edwards,Claim,2937.8,2938.48,NOT_FOUND
469,We want to get rid of tax cuts for companies sending jobs overseas.,84,30_2004,15,15,51832,51900,,"{""Claim"": 13, ""O"": 1}",Claim,We want to get rid of tax cuts for companies sending jobs overseas.,EDWARDS,Candidate,TRAIN,05 Oct 2004,2004,Johnny(John) R. Edwards,Claim,2938.48,2942.2,NOT_FOUND
470,"We want to balance this budget, get back to fiscal responsibility.",84,30_2004,16,16,51900,51967,,"{""Claim"": 12, ""O"": 1}",Claim,"We want to balance this budget, get back to fiscal responsibility.",EDWARDS,Candidate,TRAIN,05 Oct 2004,2004,Johnny(John) R. Edwards,Claim,2942.2,2945.56,NOT_FOUND
471,"And we want to invest in the creative, innovative jobs of the future.",84,30_2004,17,17,51967,52037,,"{""O"": 2, ""Claim"": 13}",Claim,"And we want to invest in the creative, innovative jobs of the future.",EDWARDS,Candidate,TRAIN,05 Oct 2004,2004,Johnny(John) R. Edwards,Claim,2945.56,2948.92,NOT_FOUND
472,"CHENEY: Gwen, we've got 111 million American taxpayers that have benefited from our income tax cuts.",86,30_2004,0,0,52067,52168,,"{""O"": 5, ""Claim"": 15}",Claim," Gwen, we've got 111 million American taxpayers that have benefited from our income tax cuts.",CHENEY,Candidate,TRAIN,05 Oct 2004,2004,Richard(Dick) B. Cheney,Claim,2949.76,2955.36,NOT_FOUND
473,We've got 33 million students who've benefited from No Child Left Behind.,86,30_2004,1,1,52168,52242,,"{""Claim"": 14, ""O"": 1}",Claim,We've got 33 million students who've benefited from No Child Left Behind.,CHENEY,Candidate,TRAIN,05 Oct 2004,2004,Richard(Dick) B. Cheney,Claim,2955.36,2959.16,NOT_FOUND
474,We've got 40 million seniors who benefited from the reform of the Medicare system.,86,30_2004,2,2,52243,52326,,"{""Claim"": 15, ""O"": 1}",Claim,We've got 40 million seniors who benefited from the reform of the Medicare system.,CHENEY,Candidate,TRAIN,05 Oct 2004,2004,Richard(Dick) B. Cheney,Claim,2959.16,2965.28,NOT_FOUND
475,The Democrats promised prescription drug benefits.,86,30_2004,3,3,52326,52377,,"{""Premise"": 6, ""O"": 1}",Premise,The Democrats promised prescription drug benefits.,CHENEY,Candidate,TRAIN,05 Oct 2004,2004,Richard(Dick) B. Cheney,Premise,2965.28,2968.0,NOT_FOUND
476,For years they've run on that platform.,86,30_2004,4,4,52377,52417,,"{""Premise"": 8, ""O"": 1}",Premise,For years they've run on that platform.,CHENEY,Candidate,TRAIN,05 Oct 2004,2004,Richard(Dick) B. Cheney,Premise,2968.0,2971.28,NOT_FOUND
477,They never got it done.,86,30_2004,5,5,52417,52441,,"{""Claim"": 5, ""O"": 1}",Claim,They never got it done.,CHENEY,Candidate,TRAIN,05 Oct 2004,2004,Richard(Dick) B. Cheney,Claim,2971.28,2972.28,NOT_FOUND
478,The president got it done.,86,30_2004,6,6,52441,52468,,"{""Claim"": 5, ""O"": 1}",Claim,The president got it done.,CHENEY,Candidate,TRAIN,05 Oct 2004,2004,Richard(Dick) B. Cheney,Claim,2972.28,2974.12,NOT_FOUND
479,"We also dropped 5 million people totally off the federal income tax rolls, so they no longer have to pay any federal income tax at all.",86,30_2004,7,7,52469,52605,,"{""Claim"": 13, ""O"": 3, ""Premise"": 12}",Claim,"We also dropped 5 million people totally off the federal income tax rolls, so they no longer have to pay any federal income tax at all.",CHENEY,Candidate,TRAIN,05 Oct 2004,2004,Richard(Dick) B. Cheney,Mixed,2974.12,2980.52,NOT_FOUND
480,"So the story, I think, is a good one.",86,30_2004,8,8,52606,52644,,"{""O"": 2, ""Claim"": 10}",Claim,"So the story, I think, is a good one.",CHENEY,Candidate,TRAIN,05 Oct 2004,2004,Richard(Dick) B. Cheney,Claim,2980.52,2984.68,NOT_FOUND
481,And the data he's using is old data.,86,30_2004,9,9,52645,52682,,"{""O"": 1, ""Premise"": 9}",Premise,And the data he's using is old data.,CHENEY,Candidate,TRAIN,05 Oct 2004,2004,Richard(Dick) B. Cheney,Premise,2984.68,2986.96,NOT_FOUND
482,It's from 2003.,86,30_2004,10,10,52682,52698,,"{""Premise"": 5}",Premise,It's from 2003.,CHENEY,Candidate,TRAIN,05 Oct 2004,2004,Richard(Dick) B. Cheney,Premise,2986.96,2988.08,NOT_FOUND
483,It doesn't include any of the gains that we've made in the last years.,86,30_2004,11,11,52698,52769,,"{""Premise"": 16, ""O"": 1}",Premise,It doesn't include any of the gains that we've made in the last years.,CHENEY,Candidate,TRAIN,05 Oct 2004,2004,Richard(Dick) B. Cheney,Premise,2988.08,2990.68,NOT_FOUND
484,We've added 1.7 million jobs to the economy.,86,30_2004,12,12,52769,52814,,"{""Claim"": 9, ""O"": 1}",Claim,We've added 1.7 million jobs to the economy.,CHENEY,Candidate,TRAIN,05 Oct 2004,2004,Richard(Dick) B. Cheney,Claim,2990.68,2993.32,NOT_FOUND
485,EDWARDS: The vice president and president like to talk about their experience on the campaign trail.,88,30_2004,0,0,52840,52941,,"{""O"": 18}",O, The vice president and president like to talk about their experience on the campaign trail.,EDWARDS,Candidate,TRAIN,05 Oct 2004,2004,Johnny(John) R. Edwards,O,2994.52,2999.44,NOT_FOUND
486,Millions of people have lost their jobs.,88,30_2004,1,1,52941,52982,,"{""Premise"": 7, ""O"": 1}",Premise,Millions of people have lost their jobs.,EDWARDS,Candidate,TRAIN,05 Oct 2004,2004,Johnny(John) R. Edwards,Premise,2999.44,3001.92,NOT_FOUND
487,Millions have fallen into poverty.,88,30_2004,2,2,52982,53017,,"{""Premise"": 5, ""O"": 1}",Premise,Millions have fallen into poverty.,EDWARDS,Candidate,TRAIN,05 Oct 2004,2004,Johnny(John) R. Edwards,Premise,3001.92,3004.16,NOT_FOUND
488,"Family incomes are down, while the cost of everything is going up.",88,30_2004,3,3,53017,53084,,"{""Premise"": 13, ""O"": 1}",Premise,"Family incomes are down, while the cost of everything is going up.",EDWARDS,Candidate,TRAIN,05 Oct 2004,2004,Johnny(John) R. Edwards,Premise,3004.16,3008.76,NOT_FOUND
489,Medical costs are up the highest they've ever been over the last four years.,88,30_2004,4,4,53084,53161,,"{""Premise"": 15, ""O"": 1}",Premise,Medical costs are up the highest they've ever been over the last four years.,EDWARDS,Candidate,TRAIN,05 Oct 2004,2004,Johnny(John) R. Edwards,Premise,3008.76,3012.52,NOT_FOUND
490,We have this mess in Iraq.,88,30_2004,5,5,53161,53188,,"{""Premise"": 6, ""O"": 1}",Premise,We have this mess in Iraq.,EDWARDS,Candidate,TRAIN,05 Oct 2004,2004,Johnny(John) R. Edwards,Premise,3012.52,3014.56,NOT_FOUND
491,"Mr. Vice President, I don't think the country can take four more years of this kind of experience.",88,30_2004,6,6,53189,53288,,"{""O"": 5, ""Claim"": 16}",Claim,"Mr. Vice President, I don't think the country can take four more years of this kind of experience.",EDWARDS,Candidate,TRAIN,05 Oct 2004,2004,Johnny(John) R. Edwards,Claim,3014.56,3019.04,NOT_FOUND
492,EDWARDS: Because we will do what they've not done.,90,30_2004,0,0,53559,53610,,"{""O"": 4, ""Claim"": 8}",Claim, Because we will do what they've not done.,EDWARDS,Candidate,TRAIN,05 Oct 2004,2004,Johnny(John) R. Edwards,Claim,3035.4,3038.28,NOT_FOUND
493,"You know, if you look at what's happened over the last four years, we have gone from a $5 trillion projected surplus when George Bush took office to a $3 trillion projected deficit.",90,30_2004,1,1,53610,53792,,"{""O"": 13, ""Claim"": 26}",Claim,"You know, if you look at what's happened over the last four years, we have gone from a $5 trillion projected surplus when George Bush took office to a $3 trillion projected deficit.",EDWARDS,Candidate,TRAIN,05 Oct 2004,2004,Johnny(John) R. Edwards,Claim,3038.28,3051.4,NOT_FOUND
494,They promised they were going to put $2 trillion of the surplus aside from Social Security.,90,30_2004,2,2,53792,53884,,"{""Premise"": 17, ""O"": 1}",Premise,They promised they were going to put $2 trillion of the surplus aside from Social Security.,EDWARDS,Candidate,TRAIN,05 Oct 2004,2004,Johnny(John) R. Edwards,Premise,3051.4,3055.76,NOT_FOUND
495,Not done.,90,30_2004,3,3,53884,53894,,"{""Claim"": 2, ""O"": 1}",Claim,Not done.,EDWARDS,Candidate,TRAIN,05 Oct 2004,2004,Johnny(John) R. Edwards,Claim,3055.76,3056.36,NOT_FOUND
496,"Not only that, it's the biggest fiscal turnaround in American history.",90,30_2004,4,4,53895,53966,,"{""O"": 14}",O,"Not only that, it's the biggest fiscal turnaround in American history.",EDWARDS,Candidate,TRAIN,05 Oct 2004,2004,Johnny(John) R. Edwards,O,3056.36,3061.36,NOT_FOUND
497,And there's no end in sight.,90,30_2004,5,5,53967,53996,,"{""O"": 8}",O,And there's no end in sight.,EDWARDS,Candidate,TRAIN,05 Oct 2004,2004,Johnny(John) R. Edwards,O,3061.36,3063.64,NOT_FOUND
498,"The Washington Post just reported they have several trillion dollars of additional tax cuts and spending, no suggestion of what they're going to do about it.",90,30_2004,6,6,53996,54154,,"{""O"": 29}",O,"The Washington Post just reported they have several trillion dollars of additional tax cuts and spending, no suggestion of what they're going to do about it.",EDWARDS,Candidate,TRAIN,05 Oct 2004,2004,Johnny(John) R. Edwards,O,3063.64,3070.6,NOT_FOUND
499,John Kerry and I believe we have a moral responsibility not to leave trillions of debt to our children and our grandchildren.,90,30_2004,7,7,54155,54281,,"{""Claim"": 22, ""O"": 1}",Claim,John Kerry and I believe we have a moral responsibility not to leave trillions of debt to our children and our grandchildren.,EDWARDS,Candidate,TRAIN,05 Oct 2004,2004,Johnny(John) R. Edwards,Claim,3070.6,3079.2,NOT_FOUND
500,"So here's what we're going to do, to answer your question.",90,30_2004,8,8,54282,54341,,"{""O"": 15}",O,"So here's what we're going to do, to answer your question.",EDWARDS,Candidate,TRAIN,05 Oct 2004,2004,Johnny(John) R. Edwards,O,3079.2,3081.76,NOT_FOUND
501,"To pay for the things that we believe need to be done -- and I hope to get the chance to talk about health care and also about education, because we have plans on both of those subjects -- what we're going to do is roll back tax cuts.",90,30_2004,9,9,54342,54577,,"{""O"": 13, ""Claim"": 31, ""Premise"": 8}",Claim,"To pay for the things that we believe need to be done -- and I hope to get the chance to talk about health care and also about education, because we have plans on both of those subjects -- what we're going to do is roll back tax cuts.",EDWARDS,Candidate,TRAIN,05 Oct 2004,2004,Johnny(John) R. Edwards,Mixed,3081.76,3092.56,NOT_FOUND
502,"And I want everyone to hear this, because there have been exaggerations made on the campaign trail: Roll back tax cuts for people who make over $200,000 a year; we will do that.",90,30_2004,10,10,54578,54756,,"{""O"": 11, ""Premise"": 23, ""Claim"": 4}",Premise,"And I want everyone to hear this, because there have been exaggerations made on the campaign trail: Roll back tax cuts for people who make over $200,000 a year; we will do that.",EDWARDS,Candidate,TRAIN,05 Oct 2004,2004,Johnny(John) R. Edwards,Mixed,3092.56,3102.72,NOT_FOUND
503,"We want to keep the tax cuts that are in place for people who make less than $200,000 a year and give additional tax cuts to those middle-class families, tax cuts for health care, tax cuts to help families pay for their college tuition, tax cuts for child care.",90,30_2004,11,11,54757,55019,,"{""Claim"": 49, ""O"": 5}",Claim,"We want to keep the tax cuts that are in place for people who make less than $200,000 a year and give additional tax cuts to those middle-class families, tax cuts for health care, tax cuts to help families pay for their college tuition, tax cuts for child care.",EDWARDS,Candidate,TRAIN,05 Oct 2004,2004,Johnny(John) R. Edwards,Claim,3102.72,3118.92,NOT_FOUND
504,"These families are struggling and hurting, and they need more tax relief, not less tax relief.",90,30_2004,12,12,55020,55115,,"{""Premise"": 10, ""O"": 4, ""Claim"": 5}",Premise,"These families are struggling and hurting, and they need more tax relief, not less tax relief.",EDWARDS,Candidate,TRAIN,05 Oct 2004,2004,Johnny(John) R. Edwards,Mixed,3118.92,3124.32,NOT_FOUND
505,"But to help get us back on the path to a balanced budget, we also want to get rid of some of the bureaucratic spending in Washington.",90,30_2004,13,13,55116,55250,,"{""O"": 15, ""Claim"": 14}",O,"But to help get us back on the path to a balanced budget, we also want to get rid of some of the bureaucratic spending in Washington.",EDWARDS,Candidate,TRAIN,05 Oct 2004,2004,Johnny(John) R. Edwards,Mixed,3124.32,3130.32,NOT_FOUND
506,"One of the amazing things that's happened is they've actually layered on more supervisory people, people at the supervisory level, in this government.",90,30_2004,14,14,55251,55402,,"{""O"": 10, ""Premise"": 18}",Premise,"One of the amazing things that's happened is they've actually layered on more supervisory people, people at the supervisory level, in this government.",EDWARDS,Candidate,TRAIN,05 Oct 2004,2004,Johnny(John) R. Edwards,Premise,3130.32,3138.32,NOT_FOUND
507,We also want to close some corporate loopholes.,90,30_2004,15,15,55403,55451,,"{""Claim"": 8, ""O"": 1}",Claim,We also want to close some corporate loopholes.,EDWARDS,Candidate,TRAIN,05 Oct 2004,2004,Johnny(John) R. Edwards,Claim,3138.32,3141.08,NOT_FOUND
508,"Now, I want to be honest with people.",90,30_2004,16,16,55452,55490,,"{""O"": 10}",O,"Now, I want to be honest with people.",EDWARDS,Candidate,TRAIN,05 Oct 2004,2004,Johnny(John) R. Edwards,O,3141.08,3142.36,NOT_FOUND
509,We can't eliminate this deficit.,90,30_2004,17,17,55490,55523,,"{""Claim"": 6, ""O"": 1}",Claim,We can't eliminate this deficit.,EDWARDS,Candidate,TRAIN,05 Oct 2004,2004,Johnny(John) R. Edwards,Claim,3142.36,3144.52,NOT_FOUND
510,People have heard that over and over and over in four years.,90,30_2004,18,18,55523,55584,,"{""O"": 13}",O,People have heard that over and over and over in four years.,EDWARDS,Candidate,TRAIN,05 Oct 2004,2004,Johnny(John) R. Edwards,O,3144.52,3147.0,NOT_FOUND
511,We cannot do it.,90,30_2004,19,19,55584,55601,,"{""Claim"": 5, ""O"": 1}",Claim,We cannot do it.,EDWARDS,Candidate,TRAIN,05 Oct 2004,2004,Johnny(John) R. Edwards,Claim,3147.0,3148.28,NOT_FOUND
512,We're in too deep a hole.,90,30_2004,20,20,55601,55627,,"{""O"": 8}",O,We're in too deep a hole.,EDWARDS,Candidate,TRAIN,05 Oct 2004,2004,Johnny(John) R. Edwards,O,3148.28,3149.4,NOT_FOUND
513,But we can cut the deficit in half.,90,30_2004,21,21,55628,55664,,"{""O"": 2, ""Claim"": 7}",Claim,But we can cut the deficit in half.,EDWARDS,Candidate,TRAIN,05 Oct 2004,2004,Johnny(John) R. Edwards,Claim,3149.4,3152.12,NOT_FOUND
514,"And if we move, we can move this country back on a path to fiscal responsibility.",90,30_2004,22,22,55664,55746,,"{""O"": 2, ""Claim"": 16}",Claim,"And if we move, we can move this country back on a path to fiscal responsibility.",EDWARDS,Candidate,TRAIN,05 Oct 2004,2004,Johnny(John) R. Edwards,Claim,3152.12,3156.44,NOT_FOUND
515,"CHENEY: Gwen, the Kerry record on taxes is one basically of voting for a large number of tax increases -- 98 times in the United States Senate.",92,30_2004,0,0,55797,55941,,"{""O"": 13, ""Claim"": 17}",Claim," Gwen, the Kerry record on taxes is one basically of voting for a large number of tax increases -- 98 times in the United States Senate.",CHENEY,Candidate,TRAIN,05 Oct 2004,2004,Richard(Dick) B. Cheney,Claim,3158.52,3172.24,NOT_FOUND
516,"There's a fundamental philosophical difference here between the president and myself, who believe that we ought to let the American people keep more of what they earn and we ought to empower them to have more control over their own lives -- I think the Kerry-Edwards approach basically is to raise taxes and to give government more control over the lives of individual citizens.",92,30_2004,1,1,55941,56320,,"{""O"": 45, ""Claim"": 22}",O,"There's a fundamental philosophical difference here between the president and myself, who believe that we ought to let the American people keep more of what they earn and we ought to empower them to have more control over their own lives -- I think the Kerry-Edwards approach basically is to raise taxes and to give government more control over the lives of individual citizens.",CHENEY,Candidate,TRAIN,05 Oct 2004,2004,Richard(Dick) B. Cheney,Mixed,3172.24,3188.36,NOT_FOUND
